{
  "$schema": "http://json-schema.org/draft-07/schema#",
  "$id": "https://krishnan-vishal.github.io/assets/data/content/schema/content-object.schema.json",
  "title": "GPIR Structured Content Object",
  "$comment": "contentModelVersion: 1.0.0 -- bump this when the envelope/typeSpecific shape changes in a way a consumer would need to know about. Referenced by change events' `contentVersion` field (docs/CONTENT_SCHEMA.md §10) -- distinct from an individual object's own `version` field.",
  "description": "Common envelope shared by all 11 GPIR content types. See docs/CONTENT_SCHEMA.md for the design rationale and the rendering-path mapping for each type.",
  "type": "object",
  "required": ["id", "title", "contentType", "status"],
  "properties": {
    "id": {
      "type": "string",
      "pattern": "^[a-z0-9]+(-[a-z0-9]+)*$",
      "description": "Stable, unique, kebab-case identifier, conventionally prefixed by type (e.g. country-uae, intel-cbuae-payment-token-2026)."
    },
    "title": { "type": "string" },
    "slug": { "type": "string" },
    "summary": { "type": ["string", "null"] },
    "description": { "type": ["string", "null"] },
    "contentType": {
      "type": "string",
      "enum": [
        "country", "region", "topic", "paymentRail", "entity",
        "corridor", "regulation", "research", "intelligence",
        "dataset", "learningAsset"
      ]
    },
    "country": { "type": ["string", "null"] },
    "region": { "type": ["string", "null"] },
    "topic": { "type": ["string", "null"] },
    "subtopic": { "type": ["string", "null"] },
    "tags": {
      "type": "array",
      "items": { "type": "string" },
      "default": []
    },
    "publicationDate": {
      "type": ["string", "null"],
      "pattern": "^\\d{4}-\\d{2}-\\d{2}$"
    },
    "lastUpdated": {
      "type": ["string", "null"],
      "pattern": "^\\d{4}-\\d{2}-\\d{2}$"
    },
    "version": { "type": "integer", "minimum": 1, "default": 1 },
    "status": {
      "type": "string",
      "enum": ["PUBLISHED", "DRAFT", "PENDING_REVIEW", "ARCHIVED", "SUPERSEDED"]
    },
    "source": {
      "type": ["object", "null"],
      "properties": {
        "name": { "type": "string" },
        "tier": { "type": "integer" },
        "url": { "type": "string", "format": "uri" }
      }
    },
    "sourceUrl": { "type": ["string", "null"], "format": "uri" },
    "relatedContent": {
      "type": "array",
      "items": { "type": "string" },
      "default": []
    },
    "renderingTarget": {
      "type": ["string", "null"],
      "description": "Repo-relative path to the existing static page this content object corresponds to, where one already exists. Not part of the prompt's required field list -- an explicit bridge field so an adapter always knows which existing rendering path a given object feeds. See docs/CONTENT_SCHEMA.md §5."
    },
    "typeSpecific": {
      "type": "object",
      "description": "Fields specific to this object's contentType. Shape varies by type -- see docs/CONTENT_SCHEMA.md §3."
    },
    "evidence": {
      "type": ["object", "null"],
      "description": "Research provenance -- only present where there is enough real, verifiable information to justify it. See docs/CONTENT_SCHEMA.md §8. Absent/null is a valid, expected state, not a gap to fill by guessing.",
      "properties": {
        "sourceName": { "type": ["string", "null"], "description": "The specific named publication/document, distinct from the organisation that issued it." },
        "sourceOrganisation": { "type": ["string", "null"] },
        "sourceType": {
          "type": ["string", "null"],
          "enum": ["PRIMARY", "REGULATORY", "MULTILATERAL", "INDUSTRY", "COMPANY", "SECONDARY", "OTHER", null]
        },
        "evidenceType": {
          "type": ["string", "null"],
          "enum": ["FACT", "DATA", "ANALYSIS", "ESTIMATE", "FORECAST", null],
          "description": "The nature of THIS object's core claim. Where a single object mixes a sourced fact with FINTECHOISIS's own interpretive commentary (common for intelligence records), this classifies the object's primary claim and `analysisFields` names which specific fields are FINTECHOISIS's own analysis layered on top."
        },
        "referencePeriod": { "type": ["string", "null"], "description": "The period the underlying data/claim applies to, where that's a real, bounded period backed by evidence -- left null rather than guessed when no such period is evidenced." },
        "retrievalDate": { "type": ["string", "null"], "pattern": "^\\d{4}-\\d{2}-\\d{2}$" },
        "verificationStatus": {
          "type": ["string", "null"],
          "enum": ["SOURCE_VERIFIED", "SOURCE_WARNING", "SOURCE_REQUIRES_VERIFICATION", "SOURCE_BLOCKED", null],
          "description": "Reuses the exact vocabulary assets/js/trust-engine.js and scripts/generate-intelligence-pages.js's evaluateSource() already compute -- not a competing classification. Set from that system's real, already-computed output, never guessed independently."
        },
        "lastReviewed": { "type": ["string", "null"], "pattern": "^\\d{4}-\\d{2}-\\d{2}$" },
        "analysisFields": {
          "type": "array",
          "items": { "type": "string" },
          "default": [],
          "description": "Names of this object's own fields (e.g. \"description\") that are FINTECHOISIS's own analysis/commentary rather than sourced fact, so a presentation component can visually separate the two without needing a second content object."
        }
      },
      "additionalProperties": false
    },
    "versionInfo": {
      "type": "object",
      "default": { "supersedes": null, "supersededBy": null },
      "description": "Lightweight content-lifecycle metadata, distinct from git history (which remains the record of every edit). Tracks only whether this object has been superseded by, or itself supersedes, another content object -- for future intelligence processing (e.g. \"show me only the current version of X\"), not a full changelog.",
      "properties": {
        "supersedes": { "type": ["string", "null"], "description": "id of an older content object this one replaces, if any." },
        "supersededBy": { "type": ["string", "null"], "description": "id of a newer content object that replaces this one, if any." }
      },
      "additionalProperties": false
    },
    "relationships": {
      "type": "array",
      "default": [],
      "description": "Typed, directed edges to other content objects. See docs/CONTENT_SCHEMA.md §7 for the controlled vocabulary and the reverse-index mechanism that derives inbound edges without hand-duplicating them.",
      "items": {
        "type": "object",
        "required": ["type", "targetId", "targetType"],
        "properties": {
          "type": {
            "type": "string",
            "enum": [
              "Country->Region", "Country->Currency", "Country->PaymentRail",
              "Country->Company", "Country->Regulator", "Country->Corridor",
              "Country->Research", "Country->Regulation",
              "Company->Country", "Company->PaymentRail", "Company->Corridor", "Company->Research",
              "PaymentRail->Country", "PaymentRail->Region", "PaymentRail->Company", "PaymentRail->Corridor",
              "Research->Country", "Research->Topic", "Research->Company",
              "Research->PaymentRail", "Research->Corridor",
              "Regulation->Country", "Regulation->Regulator",
              "Regulation->PaymentRail", "Regulation->Company"
            ]
          },
          "targetId": { "type": "string" },
          "targetType": {
            "type": "string",
            "enum": [
              "country", "region", "topic", "paymentRail", "entity",
              "corridor", "regulation", "research", "intelligence",
              "dataset", "learningAsset"
            ]
          }
        },
        "additionalProperties": false
      }
    }
  },
  "additionalProperties": false
}
